{"schema_version":1,"bank_version":"v1","surface":{"id":9,"key":"listings"},"snapshot":{"date":"2026-09-02","wordpress_target":"WordPress 7.1 current stable","sources":[{"name":"Query Loop block","url":"https://wordpress.org/documentation/article/query-loop-block/"},{"name":"WP_Query","url":"https://developer.wordpress.org/reference/classes/wp_query/"},{"name":"Block Bindings API","url":"https://developer.wordpress.org/block-editor/reference-guides/block-api/block-bindings/"},{"name":"Dynamic rendering","url":"https://developer.wordpress.org/block-editor/getting-started/fundamentals/static-dynamic-rendering/"},{"name":"Interactivity API","url":"https://developer.wordpress.org/block-editor/reference-guides/interactivity-api/"},{"name":"Template parts","url":"https://developer.wordpress.org/block-editor/reference-guides/block-api/block-templates/"},{"name":"Escaping","url":"https://developer.wordpress.org/apis/security/escaping/"},{"name":"Sanitizing","url":"https://developer.wordpress.org/apis/security/sanitizing/"}]},"status":"NATIVE_AUDITED","items":[{"id":"wp.query-loop","api":"core/query","member":"Query Loop block","disposition":"BANK_RECORD","bank_record_ids":["listings.core.013"],"evidence_url":"https://wordpress.org/documentation/article/query-loop-block/","notes":"Native collection presentation informs host-query compatibility, not WPE Query ownership."},{"id":"wp.post-template","api":"core/post-template","member":"Post Template block","disposition":"BANK_RECORD","bank_record_ids":["listings.template.001","listings.template.030"],"evidence_url":"https://wordpress.org/documentation/article/query-loop-block/","notes":"Confirms native repeated item-template rendering semantics."},{"id":"wp.query-no-results","api":"core/query-no-results","member":"No Results block","disposition":"BANK_RECORD","bank_record_ids":["listings.template.005"],"evidence_url":"https://wordpress.org/documentation/article/query-loop-block/","notes":"Native empty-state semantic is directly represented."},{"id":"wp.query-pagination","api":"core/query-pagination","member":"Query Pagination block family","disposition":"BANK_RECORD","evidence_url":"https://wordpress.org/documentation/article/query-loop-block/","notes":"Pagination presentation is a Listing semantic but query/page truth remains Surface 6/runtime owned."},{"id":"wp.block-bindings","api":"Block Bindings API","member":"block bindings sources","disposition":"BANK_RECORD","bank_record_ids":["listings.template.010","listings.template.011","listings.template.018"],"evidence_url":"https://developer.wordpress.org/block-editor/reference-guides/block-api/block-bindings/","notes":"Supports typed dynamic-value binding patterns while WPE keeps source ownership external."},{"id":"wp.dynamic-render","api":"register_block_type/render_callback","member":"dynamic server rendering","disposition":"BANK_RECORD","bank_record_ids":["listings.template.030"],"evidence_url":"https://developer.wordpress.org/block-editor/getting-started/fundamentals/static-dynamic-rendering/","notes":"Supports the server-first baseline."},{"id":"wp.template-parts","api":"block templates/template parts","member":"template part composition","disposition":"BANK_RECORD","bank_record_ids":["listings.template.003","listings.template.004"],"evidence_url":"https://developer.wordpress.org/block-editor/reference-guides/block-api/block-templates/","notes":"Confirms reusable header/footer composition patterns without making theme templates canonical Listing storage."},{"id":"wp.interactivity-api","api":"Interactivity API","member":"directives/store/actions","disposition":"SYSTEM_RUNTIME","evidence_url":"https://developer.wordpress.org/block-editor/reference-guides/interactivity-api/","notes":"Candidate progressive enhancement mechanism only; server remains source of truth."},{"id":"wp.wp-query","api":"WP_Query","member":"post query execution","disposition":"OUT_OF_SURFACE","owner_surface":"query","evidence_url":"https://developer.wordpress.org/reference/classes/wp_query/","notes":"Surface 6/Data Source adapters own query semantics and execution; Listings must not embed raw argument bags."},{"id":"wp.wp-user-query","api":"WP_User_Query","member":"user query execution","disposition":"OUT_OF_SURFACE","owner_surface":"query","evidence_url":"https://developer.wordpress.org/reference/classes/wp_user_query/","notes":"User-result retrieval belongs to Query/Data Source ownership."},{"id":"wp.wp-term-query","api":"WP_Term_Query","member":"term query execution","disposition":"OUT_OF_SURFACE","owner_surface":"query","evidence_url":"https://developer.wordpress.org/reference/classes/wp_term_query/","notes":"Taxonomy-result retrieval belongs to Query/Data Source ownership."},{"id":"wp.escape-context","api":"esc_html/esc_attr/esc_url","member":"contextual escaping","disposition":"SYSTEM_RUNTIME","evidence_url":"https://developer.wordpress.org/apis/security/escaping/","notes":"Shared Renderer implements context-correct escaping represented by Listings render requirements."},{"id":"wp.sanitize-rich-html","api":"wp_kses","member":"allowed HTML sanitization","disposition":"SYSTEM_RUNTIME","evidence_url":"https://developer.wordpress.org/apis/security/sanitizing/","notes":"Shared Renderer/sanitization policy handles rich content; Listing authored config is not an execution channel."},{"id":"wp.accessibility","api":"WordPress accessibility coding standards","member":"WCAG-oriented interface requirements","disposition":"BANK_RECORD","evidence_url":"https://developer.wordpress.org/coding-standards/wordpress-coding-standards/accessibility/","notes":"Supports semantic, keyboard, focus and announcement requirements captured by the Listings Bank."}],"coverage":{"items":14,"bank_record":8,"provider_mapping":0,"system_runtime":3,"out_of_surface":3,"legacy_compatibility":0,"core_internal":0,"unresolved":0}}