{"schema_version":1,"bank_version":"v1","surface":{"id":10,"key":"dashboard-widgets"},"snapshot":{"date":"2026-09-01","wordpress_target":"Current supported WordPress Dashboard/Screen APIs (reviewed 2026-09-01)","sources":[{"name":"Dashboard Widgets API","url":"https://developer.wordpress.org/apis/dashboard-widgets/"},{"name":"wp_add_dashboard_widget()","url":"https://developer.wordpress.org/reference/functions/wp_add_dashboard_widget/"},{"name":"wp_dashboard_setup()","url":"https://developer.wordpress.org/reference/functions/wp_dashboard_setup/"},{"name":"Screen/meta box preferences","url":"https://developer.wordpress.org/reference/files/wp-admin/includes/screen.php/"}]},"status":"NATIVE_AUDITED","items":[{"id":"dashboard-widgets.native.wp_add.widget_id","api":"wp_add_dashboard_widget","member":"widget_id","disposition":"BANK_RECORD","evidence_url":"https://developer.wordpress.org/reference/functions/wp_add_dashboard_widget/","notes":"Native widget_id maps to the canonical authored widget key; no duplicate native-ID control.","bank_record_ids":["dashboard-widgets.widget.key"]},{"id":"dashboard-widgets.native.wp_add.widget_name","api":"wp_add_dashboard_widget","member":"widget_name","disposition":"BANK_RECORD","evidence_url":"https://developer.wordpress.org/reference/functions/wp_add_dashboard_widget/","notes":"Native widget_name maps to the canonical authored widget title; no duplicate native-name control.","bank_record_ids":["dashboard-widgets.widget.title"]},{"id":"dashboard-widgets.native.wp_add.callback","api":"wp_add_dashboard_widget","member":"callback","disposition":"PROVIDER_MAPPING","evidence_url":"https://developer.wordpress.org/reference/functions/wp_add_dashboard_widget/","notes":"Executable callback is represented by an allowlisted renderer/provider rather than stored PHP.","bank_record_ids":["dashboard-widgets.native.render_provider"]},{"id":"dashboard-widgets.native.wp_add.control_callback","api":"wp_add_dashboard_widget","member":"control_callback","disposition":"PROVIDER_MAPPING","evidence_url":"https://developer.wordpress.org/reference/functions/wp_add_dashboard_widget/","notes":"Optional configuration callback maps to a registered configure-control provider.","bank_record_ids":["dashboard-widgets.native.control_provider"]},{"id":"dashboard-widgets.native.wp_add.callback_args","api":"wp_add_dashboard_widget","member":"callback_args","disposition":"PROVIDER_MAPPING","evidence_url":"https://developer.wordpress.org/reference/functions/wp_add_dashboard_widget/","notes":"Callback arguments are represented by typed provider data.","bank_record_ids":["dashboard-widgets.native.callback_args_provider"]},{"id":"dashboard-widgets.native.wp_add.context","api":"wp_add_dashboard_widget","member":"context","disposition":"BANK_RECORD","evidence_url":"https://developer.wordpress.org/reference/functions/wp_add_dashboard_widget/","notes":"Current WordPress supports normal, side, column3 and column4.","bank_record_ids":["dashboard-widgets.presentation.context"]},{"id":"dashboard-widgets.native.wp_add.priority","api":"wp_add_dashboard_widget","member":"priority","disposition":"BANK_RECORD","evidence_url":"https://developer.wordpress.org/reference/functions/wp_add_dashboard_widget/","notes":"Current WordPress supports high, core, default and low.","bank_record_ids":["dashboard-widgets.presentation.priority"]},{"id":"dashboard-widgets.native.wp_add.edit_dashboard","api":"wp_add_dashboard_widget","member":"edit_dashboard capability gate","disposition":"SYSTEM_RUNTIME","evidence_url":"https://developer.wordpress.org/reference/functions/wp_add_dashboard_widget/","notes":"WordPress only exposes widget controls when the current user can edit_dashboard; WPE actions must still pass canonical Policy."},{"id":"dashboard-widgets.native.setup.site_hook","api":"wp_dashboard_setup","member":"wp_dashboard_setup action","disposition":"SYSTEM_RUNTIME","evidence_url":"https://developer.wordpress.org/apis/dashboard-widgets/","notes":"Site dashboard registrations occur on the canonical setup action."},{"id":"dashboard-widgets.native.setup.network_hook","api":"Dashboard Widgets API","member":"wp_network_dashboard_setup action","disposition":"BANK_RECORD","evidence_url":"https://developer.wordpress.org/apis/dashboard-widgets/","notes":"Network Admin has a distinct registration hook and target.","bank_record_ids":["dashboard-widgets.target.network_dashboard"]},{"id":"dashboard-widgets.native.remove.widget","api":"remove_meta_box","member":"widget id/screen/context","disposition":"BANK_RECORD","evidence_url":"https://developer.wordpress.org/reference/functions/remove_meta_box/","notes":"Native removal/hide operation for registered dashboard meta boxes.","bank_record_ids":["dashboard-widgets.inventory.hide"]},{"id":"dashboard-widgets.native.inventory.default_widgets","api":"Dashboard Widgets API","member":"default dashboard widget IDs","disposition":"SYSTEM_RUNTIME","evidence_url":"https://developer.wordpress.org/apis/dashboard-widgets/","notes":"Core widget IDs are runtime inventory facts rather than authored WPE widget definitions."},{"id":"dashboard-widgets.native.hidden.user_state","api":"get_hidden_meta_boxes","member":"metaboxhidden_{screen} user option","disposition":"BANK_RECORD","evidence_url":"https://developer.wordpress.org/reference/functions/get_hidden_meta_boxes/","notes":"WordPress persists hidden meta-box state per user/screen.","bank_record_ids":["dashboard-widgets.preference.user_hide"]},{"id":"dashboard-widgets.native.hidden.default_filter","api":"default_hidden_meta_boxes","member":"default hidden IDs","disposition":"BANK_RECORD","evidence_url":"https://developer.wordpress.org/reference/hooks/default_hidden_meta_boxes/","notes":"Default hidden state can be filtered before a user has an explicit preference.","bank_record_ids":["dashboard-widgets.inventory.default_hidden"]},{"id":"dashboard-widgets.native.hidden.effective_filter","api":"hidden_meta_boxes","member":"effective hidden IDs","disposition":"SYSTEM_RUNTIME","evidence_url":"https://developer.wordpress.org/reference/hooks/hidden_meta_boxes/","notes":"Effective hidden state is a resolved runtime preference; do not create a second authored visibility option."},{"id":"dashboard-widgets.native.screen.meta_box_prefs","api":"meta_box_prefs","member":"Screen Options meta-box checkboxes","disposition":"BANK_RECORD","evidence_url":"https://developer.wordpress.org/reference/files/wp-admin/includes/screen.php/","notes":"Native Screen Options exposes user hide/show preferences.","bank_record_ids":["dashboard-widgets.preference.user_hide"]},{"id":"dashboard-widgets.native.screen.reorder","api":"do_meta_boxes","member":"user meta-box order","disposition":"BANK_RECORD","evidence_url":"https://developer.wordpress.org/reference/functions/do_meta_boxes/","notes":"Dashboard meta boxes support user-controlled ordering through core screen behavior.","bank_record_ids":["dashboard-widgets.preference.user_reorder"]},{"id":"dashboard-widgets.native.screen.collapse","api":"do_meta_boxes","member":"closed postbox state","disposition":"BANK_RECORD","evidence_url":"https://developer.wordpress.org/reference/functions/do_meta_boxes/","notes":"Dashboard postboxes expose collapse behavior and persisted user state.","bank_record_ids":["dashboard-widgets.preference.user_collapse","dashboard-widgets.presentation.collapsible"]},{"id":"dashboard-widgets.native.dashboard.columns","api":"wp_dashboard","member":"normal/side/column3/column4 containers","disposition":"BANK_RECORD","evidence_url":"https://developer.wordpress.org/reference/functions/wp_dashboard/","notes":"Dashboard renders the four current meta-box contexts.","bank_record_ids":["dashboard-widgets.presentation.context"]},{"id":"dashboard-widgets.native.dashboard.setup_nonce","api":"wp_dashboard_setup","member":"dashboard widget configure nonce","disposition":"SYSTEM_RUNTIME","evidence_url":"https://developer.wordpress.org/reference/functions/wp_dashboard_setup/","notes":"Core protects configuration submission with a nonce; downstream WPE configuration must preserve CSRF protection."},{"id":"dashboard-widgets.native.dashboard.control_dispatch","api":"wp_dashboard_setup","member":"wp_dashboard_trigger_widget_control","disposition":"SYSTEM_RUNTIME","evidence_url":"https://developer.wordpress.org/reference/functions/wp_dashboard_setup/","notes":"Core dispatches registered widget controls; WPE must not create an alternate privileged mutation path."},{"id":"dashboard-widgets.native.api.user_override_order","api":"Dashboard Widgets API","member":"user reorder overrides default insertion order","disposition":"BANK_RECORD","evidence_url":"https://developer.wordpress.org/apis/dashboard-widgets/","notes":"WordPress documentation notes that existing user order overrides programmatic default ordering.","bank_record_ids":["dashboard-widgets.preference.user_reorder","dashboard-widgets.presentation.order"]},{"id":"dashboard-widgets.native.api.user_screen_options","api":"Dashboard Widgets API","member":"user can turn off widget","disposition":"BANK_RECORD","evidence_url":"https://developer.wordpress.org/apis/dashboard-widgets/","notes":"Native Screen Options permit individual users to hide widgets.","bank_record_ids":["dashboard-widgets.preference.user_hide"]},{"id":"dashboard-widgets.native.api.rss_caching","api":"Dashboard Widgets API","member":"RSS caching recommendation","disposition":"PROVIDER_MAPPING","evidence_url":"https://developer.wordpress.org/apis/dashboard-widgets/","notes":"Remote RSS must use canonical Safe HTTP/connection and cache providers rather than a private transport stack.","bank_record_ids":["dashboard-widgets.type.rss","dashboard-widgets.remote.connection_ref","dashboard-widgets.cache.ttl"]}],"coverage":{"items":24,"bank_record":14,"provider_mapping":4,"system_runtime":6,"out_of_surface":0,"legacy_compatibility":0,"core_internal":0,"unresolved":0}}
